{
    "by_classification": {
        "FalsePositive": 204,
        "InformationalExpectedActivity": 191,
        "TruePositive": 196
    },
    "by_severity": {
        "Critical": 159,
        "High": 149,
        "Low": 135,
        "Medium": 148
    },
    "by_status": {
        "Active": 193,
        "InProgress": 201,
        "Resolved": 197
    },
    "recent_incidents": 591,
    "top_malware_families": {
        "BlackEnergy": 58,
        "Cobalt Strike": 70,
        "Emotet": 62,
        "Industroyer": 71,
        "Mimikatz": 61,
        "PowerShell Empire": 64,
        "Qakbot": 70,
        "TRITON": 71,
        "TrickBot": 64
    },
    "top_threat_actors": {
        "APT28": 67,
        "APT33": 68,
        "Lazarus Group": 60
    },
    "total_incidents": 591
}